{
  "version": "1.0",
  "generated_at": "2026-01-20T01:14:12Z",
  "source_plan": "docs/plans/live-smoke-verify-strict-autonomy-generate-spec-plan.md",
  "tasks": [
    {
      "id": "autocodex-e36",
      "title": "Live smoke: verify strict autonomy (spec/plan/tasks + evidence)",
      "goal": "Generate single-bead spec/plan/tasks artifacts, emit ACTIONS JSON evidence, and close the bead.",
      "scope": [
        "docs/specs",
        "docs/plans"
      ],
      "files": [
        "docs/specs/live-smoke-verify-strict-autonomy-generate-spec.md",
        "docs/plans/live-smoke-verify-strict-autonomy-generate-spec-plan.md",
        "docs/plans/live-smoke-verify-strict-autonomy-generate-spec-tasks.json",
        "docs/plans/autocodex-autonomy-strictness-evidence.md"
      ],
      "dependencies": [],
      "skills": [
        "core-holistic-planning-and-tracking"
      ],
      "acceptance_criteria": [
        "Spec, plan, and tasks files exist and reference the same slug.",
        "Evidence doc includes compliant ACTIONS JSON with next.type=none, bead done, and gates.blocking=false.",
        "bd show autocodex-e36 reports status done."
      ],
      "tests": [
        "ACTIONS JSON emitted in evidence doc."
      ],
      "docs": [
        "docs/specs/live-smoke-verify-strict-autonomy-generate-spec.md",
        "docs/plans/live-smoke-verify-strict-autonomy-generate-spec-plan.md",
        "docs/plans/autocodex-autonomy-strictness-evidence.md"
      ],
      "rollout": "Close bead autocodex-e36 and run bd sync at session end.",
      "observability": "N/A (doc-only).",
      "status": "in_progress",
      "priority": 2,
      "owner": "conqueror",
      "notes": "Doc-only smoke; Jira sync skipped (no repo Jira guidelines found)."
    }
  ]
}
